[
  {
    "id": "commit-HYP3R00T/rajeshdas.dev-224362a",
    "type": "commit",
    "at": "2025-10-30T12:11:27Z",
    "actor": "HYP3R00T",
    "project_id": "HYP3R00T/rajeshdas.dev",
    "title": "feat(workspace): add pnpm workspace configuration",
    "url": "https://github.com/HYP3R00T/rajeshdas.dev/commit/224362af8765ae574860ec020e090caaf10ca2b3"
  },
  {
    "id": "commit-HYP3R00T/rajeshdas.dev-c86e82c",
    "type": "commit",
    "at": "2025-10-30T11:55:05Z",
    "actor": "HYP3R00T",
    "project_id": "HYP3R00T/rajeshdas.dev",
    "title": "chore(workspace): remove unused built dependencies",
    "url": "https://github.com/HYP3R00T/rajeshdas.dev/commit/c86e82c5730c1a99538c6a38627ec5983a701e97"
  },
  {
    "id": "commit-HYP3R00T/rajeshdas.dev-80e0b22",
    "type": "commit",
    "at": "2025-10-30T09:26:44Z",
    "actor": "HYP3R00T",
    "project_id": "HYP3R00T/rajeshdas.dev",
    "title": "feat(accordion): enhance accordion component with icons and content",
    "url": "https://github.com/HYP3R00T/rajeshdas.dev/commit/80e0b22476efd8a84d66c4bc1c726a0851f03d1a"
  },
  {
    "id": "commit-HYP3R00T/rajeshdas.dev-aebf8ef",
    "type": "commit",
    "at": "2025-10-30T09:26:31Z",
    "actor": "HYP3R00T",
    "project_id": "HYP3R00T/rajeshdas.dev",
    "title": "feat(icons): add SVG icons for caret and unfold actions",
    "url": "https://github.com/HYP3R00T/rajeshdas.dev/commit/aebf8efdd2e1803b8724b7e024a0da3b7352c82b"
  },
  {
    "id": "commit-HYP3R00T/rajeshdas.dev-4573a0b",
    "type": "commit",
    "at": "2025-10-29T20:28:33Z",
    "actor": "HYP3R00T",
    "project_id": "HYP3R00T/rajeshdas.dev",
    "title": "feat(accordion): implement accordion component with functionality",
    "url": "https://github.com/HYP3R00T/rajeshdas.dev/commit/4573a0b494ec887b6bf23d94b50e9010c4ab434e"
  },
  {
    "id": "commit-HYP3R00T/rajeshdas.dev-f019615",
    "type": "commit",
    "at": "2025-10-29T20:28:08Z",
    "actor": "HYP3R00T",
    "project_id": "HYP3R00T/rajeshdas.dev",
    "title": "chore(dependencies): update package versions for improvements",
    "url": "https://github.com/HYP3R00T/rajeshdas.dev/commit/f019615c67e55e153365e0423b45a6e9771ea39e"
  },
  {
    "id": "commit-HYP3R00T/rajeshdas.dev-fab69ed",
    "type": "commit",
    "at": "2025-10-29T20:27:50Z",
    "actor": "HYP3R00T",
    "project_id": "HYP3R00T/rajeshdas.dev",
    "title": "style(prose): adjust link underline height for better visibility",
    "url": "https://github.com/HYP3R00T/rajeshdas.dev/commit/fab69ed020c0c357ab60e51e72a34e6f9aeaeae6"
  },
  {
    "id": "commit-HYP3R00T/rajeshdas.dev-8524231",
    "type": "commit",
    "at": "2025-10-29T20:27:40Z",
    "actor": "HYP3R00T",
    "project_id": "HYP3R00T/rajeshdas.dev",
    "title": "style(header): update gradient class for logo background",
    "url": "https://github.com/HYP3R00T/rajeshdas.dev/commit/8524231695c7d187b1bef9d9cd43b1314b20056b"
  },
  {
    "id": "commit-HYP3R00T/d2lab-e7f700b",
    "type": "commit",
    "at": "2025-10-26T20:52:06Z",
    "actor": "HYP3R00T",
    "project_id": "HYP3R00T/d2lab",
    "title": "feat: add demo diagram",
    "url": "https://github.com/HYP3R00T/d2lab/commit/e7f700b8d2f0351c5461afeb215c0909d8009d1c"
  },
  {
    "id": "commit-HYP3R00T/d2lab-19d5e44",
    "type": "commit",
    "at": "2025-10-26T20:32:22Z",
    "actor": "HYP3R00T",
    "project_id": "HYP3R00T/d2lab",
    "title": "chore(mise.toml): remove commented-out run commands",
    "url": "https://github.com/HYP3R00T/d2lab/commit/19d5e44fedbe4494cde2644bfb6cf17802d4e39c"
  },
  {
    "id": "commit-HYP3R00T/d2lab-a3f5410",
    "type": "commit",
    "at": "2025-10-26T20:32:22Z",
    "actor": "HYP3R00T",
    "project_id": "HYP3R00T/d2lab",
    "title": "chore(devcontainer): rename project from awsbreaker to d2lab",
    "url": "https://github.com/HYP3R00T/d2lab/commit/a3f5410a575f6333ebc0aca6e9b96f312617b8c2"
  },
  {
    "id": "commit-HYP3R00T/d2lab-30618ca",
    "type": "commit",
    "at": "2025-10-26T20:32:22Z",
    "actor": "HYP3R00T",
    "project_id": "HYP3R00T/d2lab",
    "title": "docs: update output file names in README",
    "url": "https://github.com/HYP3R00T/d2lab/commit/30618caea575a762cae506bcc6596fbcc05e6886"
  },
  {
    "id": "commit-HYP3R00T/homelab-9b38bee",
    "type": "commit",
    "at": "2025-10-19T18:36:35Z",
    "actor": "HYP3R00T",
    "project_id": "HYP3R00T/homelab",
    "title": "fix: update remote reference keys in externalSecret.yaml for correct path resolution",
    "url": "https://github.com/HYP3R00T/homelab/commit/9b38bee95db5699609b3ba584cbb57c1920965ef"
  },
  {
    "id": "commit-HYP3R00T/homelab-11f3240",
    "type": "commit",
    "at": "2025-10-19T18:36:30Z",
    "actor": "HYP3R00T",
    "project_id": "HYP3R00T/homelab",
    "title": "feat: add external-secrets HelmRelease and HelmRepository configurations, update ClusterSecretStore and values for improved integration",
    "url": "https://github.com/HYP3R00T/homelab/commit/11f3240a960ac8c31c36f3021a63fc34c99eb19c"
  },
  {
    "id": "commit-HYP3R00T/homelab-60e3a3b",
    "type": "commit",
    "at": "2025-10-19T18:36:18Z",
    "actor": "HYP3R00T",
    "project_id": "HYP3R00T/homelab",
    "title": "feat: add cert-manager configuration with ClusterIssuers, Certificates, HelmRelease, and associated resources for improved certificate management",
    "url": "https://github.com/HYP3R00T/homelab/commit/60e3a3b76a6358c0772ed40ae20193ac3e2f481c"
  },
  {
    "id": "commit-HYP3R00T/homelab-da5c8d9",
    "type": "commit",
    "at": "2025-10-18T07:30:08Z",
    "actor": "HYP3R00T",
    "project_id": "HYP3R00T/homelab",
    "title": "refactor: remove unused service nodePort configurations from Grafana, Prometheus, and Alertmanager",
    "url": "https://github.com/HYP3R00T/homelab/commit/da5c8d90b1a8ec511f63a29a2fd9d34d8267bbdd"
  },
  {
    "id": "commit-HYP3R00T/homelab-b364788",
    "type": "commit",
    "at": "2025-10-17T17:57:05Z",
    "actor": "HYP3R00T",
    "project_id": "HYP3R00T/homelab",
    "title": "refactor: remove documentation as it is being hosted in a seprate repo",
    "url": "https://github.com/HYP3R00T/homelab/commit/b36478812d47d28eeb284d2227e25a40c14b7dfd"
  },
  {
    "id": "commit-HYP3R00T/homelab-df66a4e",
    "type": "commit",
    "at": "2025-10-17T17:44:58Z",
    "actor": "HYP3R00T",
    "project_id": "HYP3R00T/homelab",
    "title": "feat: add kube-prometheus-stack configuration with HelmRelease, HelmRepository, and associated resources for monitoring setup",
    "url": "https://github.com/HYP3R00T/homelab/commit/df66a4ed16ba0974de404b59ea1148c192b3bd11"
  },
  {
    "id": "commit-HYP3R00T/homelab-4dc03c0",
    "type": "commit",
    "at": "2025-10-17T17:38:11Z",
    "actor": "HYP3R00T",
    "project_id": "HYP3R00T/homelab",
    "title": "refactor: update nginx configuration by modifying kustomization, ocirepository, and values files for improved structure and clarity",
    "url": "https://github.com/HYP3R00T/homelab/commit/4dc03c0a64fa374d1dd1fb5a24e43a8cf64e360f"
  },
  {
    "id": "commit-HYP3R00T/homelab-31e635b",
    "type": "commit",
    "at": "2025-10-17T17:11:20Z",
    "actor": "HYP3R00T",
    "project_id": "HYP3R00T/homelab",
    "title": "fix: update nginx OCI repository semver to 22.0.11 and add comment in values.yaml",
    "url": "https://github.com/HYP3R00T/homelab/commit/31e635b2b9108eecafe1aaf6b17c83b963ba7a51"
  },
  {
    "id": "commit-HYP3R00T/homelab-7ba2812",
    "type": "commit",
    "at": "2025-10-13T16:04:02Z",
    "actor": "HYP3R00T",
    "project_id": "HYP3R00T/homelab",
    "title": "feat: add AI Fiesta service to the homepage configuration",
    "url": "https://github.com/HYP3R00T/homelab/commit/7ba2812da744d03318925e15dca529d3f967d22f"
  },
  {
    "id": "pull_merged-HYP3R00T/CostCutter-21",
    "type": "pull_merged",
    "at": "2025-10-07T05:14:52Z",
    "actor": "HYP3R00T",
    "project_id": "HYP3R00T/CostCutter",
    "title": "Feat/add ec2 security groups",
    "url": "https://github.com/HYP3R00T/CostCutter/pull/21"
  },
  {
    "id": "commit-HYP3R00T/CostCutter-b856ec6",
    "type": "commit",
    "at": "2025-10-07T05:14:51Z",
    "actor": "HYP3R00T",
    "project_id": "HYP3R00T/CostCutter",
    "title": "Feat/add ec2 security groups (#21)",
    "url": "https://github.com/HYP3R00T/CostCutter/commit/b856ec6e6198d46a15acaddbda71b0b3eb4c332b"
  },
  {
    "id": "pull_opened-HYP3R00T/CostCutter-21",
    "type": "pull_opened",
    "at": "2025-10-07T05:12:57Z",
    "actor": "HYP3R00T",
    "project_id": "HYP3R00T/CostCutter",
    "title": "Feat/add ec2 security groups",
    "url": "https://github.com/HYP3R00T/CostCutter/pull/21"
  },
  {
    "id": "pull_merged-HYP3R00T/CostCutter-20",
    "type": "pull_merged",
    "at": "2025-10-07T04:27:15Z",
    "actor": "HYP3R00T",
    "project_id": "HYP3R00T/CostCutter",
    "title": "docs: enhance documentation structure and add placeholders in pages",
    "url": "https://github.com/HYP3R00T/CostCutter/pull/20"
  },
  {
    "id": "commit-HYP3R00T/CostCutter-a3aba8d",
    "type": "commit",
    "at": "2025-10-07T04:27:14Z",
    "actor": "HYP3R00T",
    "project_id": "HYP3R00T/CostCutter",
    "title": "docs: enhance documentation structure and add placeholders in pages (#20)",
    "url": "https://github.com/HYP3R00T/CostCutter/commit/a3aba8d445cf540608586c16e312c7549f27cc22"
  },
  {
    "id": "pull_opened-HYP3R00T/CostCutter-20",
    "type": "pull_opened",
    "at": "2025-10-07T04:25:32Z",
    "actor": "HYP3R00T",
    "project_id": "HYP3R00T/CostCutter",
    "title": "docs: enhance documentation structure and add placeholders in pages",
    "url": "https://github.com/HYP3R00T/CostCutter/pull/20"
  },
  {
    "id": "pull_merged-HYP3R00T/CostCutter-19",
    "type": "pull_merged",
    "at": "2025-10-07T03:49:24Z",
    "actor": "HYP3R00T",
    "project_id": "HYP3R00T/CostCutter",
    "title": "feat(docs): update guides and configuration for CostCutter",
    "url": "https://github.com/HYP3R00T/CostCutter/pull/19"
  },
  {